<?xml version="1.0" encoding="UTF-8"?>
<!DOCTYPE bib SYSTEM "books.dtd">
<bib>
  <book>
    <title>TCP/IP Illustrated</title>
    <author>
      <last>Stevens</last>
      <first>W.</first>
    </author>
    <year>1994</year>
    <publisher>Addison-Wesley</publisher>
    <price>65.95</price>
  </book>
  <book>
    <title>Advanced Programming in the Unix environment</title>
    <author>
      <last>Stevens</last>
      <first>W.</first>
    </author>
    <year>1992</year>
    <publisher>Addison-Wesley</publisher>
    <price>65.95</price>
  </book>
  <book>
    <title>Data on the Web</title>
    <author>
      <last>Abiteboul</last>
      <first>Serge</first>
    </author>
    <author>
      <last>Buneman</last>
      <first>Peter</first>
    </author>
    <author>
      <last>Suciu</last>
      <first>Dan</first>
    </author>
    <year>2000</year>
    <publisher>Morgan Kaufmann Publishers</publisher>
    <price>39.95</price>
  </book>
  <book>
    <title>The Economics of Technology and Content for Digital TV</title>
    <editor>
      <last>Gerbarg</last>
      <first>Darcy</first>
      <affiliation>CITI</affiliation>
    </editor>
    <year>1999</year>
    <publisher>Kluwer Academic Publishers</publisher>
    <price>129.95</price>
  </book>
</bib>
